[
  {
    "file": "3dbenchy-lowpoly.glb",
    "name": "3DBenchy",
    "kind": "calibration",
    "fidelity": "calibration",
    "source": {
      "url": "https://github.com/CreativeTools/3DBenchy",
      "license": "CC0-1.0"
    },
    "hullForm": "calibration print, a small motor-cruiser shape",
    "propulsion": [
      "power"
    ],
    "shows": [
      "wheelhouse"
    ],
    "loaM": null,
    "beamM": null,
    "draftM": null,
    "nominal": true,
    "fitLengthM": null,
    "proportions": {
      "lengthBeam": 1.929,
      "lengthHeight": 1.207
    },
    "frame": {
      "waterlineZ": -1.699,
      "hullX": [
        -29.176,
        30.817
      ]
    },
    "lights": {
      "masthead": [
        -0.045,
        2.043
      ],
      "sidelight": [
        0.612,
        1.036
      ],
      "stern": [
        -1,
        0.587
      ]
    }
  },
  {
    "file": "catalina-30-mkii.glb",
    "name": "Catalina 30 Mk II",
    "kind": "traced",
    "fidelity": "traced",
    "source": {
      "trace": "docs/research/sailboat-lines/catalina-30-mkii.json",
      "url": "https://sailboatdata.com/sailboat/catalina-30-mkii/",
      "license": "AGPL-3.0"
    },
    "hullForm": "masthead sloop, fin keel, spade rudder",
    "rig": "masthead sloop",
    "propulsion": [
      "sail",
      "power"
    ],
    "shows": [
      "sails"
    ],
    "loaM": 9.12,
    "beamM": 3.3,
    "draftM": 1.6,
    "nominal": false,
    "fitLengthM": [
      7,
      11
    ],
    "aisType": 36,
    "proportions": {
      "lengthBeam": 2.735,
      "lengthHeight": 0.659
    },
    "frame": {
      "waterlineZ": 0,
      "hullX": [
        -1,
        1
      ]
    },
    "lights": {
      "masthead": [
        0.198,
        3.741
      ],
      "sidelight": [
        0.35,
        0.319
      ],
      "stern": [
        -0.999,
        0.519
      ]
    }
  },
  {
    "file": "cheoy-lee-clipper-48-schooner.glb",
    "name": "Cheoy Lee Clipper 48 Schooner",
    "kind": "traced",
    "fidelity": "traced",
    "source": {
      "trace": "docs/research/sailboat-lines/cheoy-lee-clipper-48-schooner.json",
      "url": "https://sailboatdata.com/sailboat/clipper-48-schooner-cheoy-lee/",
      "license": "AGPL-3.0"
    },
    "hullForm": "two-masted staysail schooner, long keel",
    "rig": "two-masted staysail schooner",
    "propulsion": [
      "sail",
      "power"
    ],
    "shows": [
      "sails",
      "bowsprit"
    ],
    "loaM": 14.61,
    "beamM": 3.96,
    "draftM": 1.83,
    "nominal": false,
    "fitLengthM": [
      12,
      18
    ],
    "aisType": 36,
    "proportions": {
      "lengthBeam": 3.622,
      "lengthHeight": 0.882
    },
    "frame": {
      "waterlineZ": 0,
      "hullX": [
        -1,
        1
      ]
    },
    "lights": {
      "masthead": [
        -0.261,
        2.795
      ],
      "sidelight": [
        0.462,
        0.247
      ],
      "stern": [
        -1.095,
        0.466
      ]
    }
  },
  {
    "file": "com-pac-16.glb",
    "name": "Com-Pac 16",
    "kind": "traced",
    "fidelity": "traced",
    "source": {
      "trace": "docs/research/sailboat-lines/com-pac-16.json",
      "url": "https://sailboatdata.com/sailboat/com-pac-16/",
      "license": "AGPL-3.0"
    },
    "hullForm": "fractional sloop, fin w/transom hung rudder",
    "rig": "fractional sloop",
    "propulsion": [
      "sail",
      "power"
    ],
    "shows": [
      "sails"
    ],
    "loaM": 4.88,
    "beamM": 1.83,
    "draftM": 0.46,
    "nominal": false,
    "fitLengthM": [
      4,
      6
    ],
    "aisType": 36,
    "proportions": {
      "lengthBeam": 2.473,
      "lengthHeight": 0.745
    },
    "frame": {
      "waterlineZ": 0,
      "hullX": [
        -1,
        1
      ]
    },
    "lights": {
      "masthead": [
        0.374,
        3.313
      ],
      "sidelight": [
        0.402,
        0.327
      ],
      "stern": [
        -0.998,
        0.296
      ]
    }
  },
  {
    "file": "hans-christian-38t.glb",
    "name": "Hans Christian 38T",
    "kind": "traced",
    "fidelity": "traced",
    "source": {
      "trace": "docs/research/sailboat-lines/hans-christian-38t.json",
      "url": "https://sailboatdata.com/sailboat/hans-christian-38t/",
      "license": "AGPL-3.0"
    },
    "hullForm": "cutter, long keel",
    "rig": "cutter",
    "propulsion": [
      "sail",
      "power"
    ],
    "shows": [
      "sails",
      "bowsprit"
    ],
    "loaM": 11.56,
    "beamM": 3.76,
    "draftM": 1.83,
    "nominal": false,
    "fitLengthM": [
      9,
      14
    ],
    "aisType": 36,
    "proportions": {
      "lengthBeam": 3.065,
      "lengthHeight": 0.694
    },
    "frame": {
      "waterlineZ": 0,
      "hullX": [
        -1,
        1
      ]
    },
    "lights": {
      "masthead": [
        0.207,
        3.556
      ],
      "sidelight": [
        0.495,
        0.295
      ],
      "stern": [
        -1.077,
        0.289
      ]
    }
  },
  {
    "file": "kenney-boat-fan.glb",
    "name": "Airboat",
    "kind": "kit",
    "fidelity": "stylised",
    "source": {
      "kit": "Kenney Watercraft Kit",
      "kitFile": "boat-fan.glb",
      "url": "https://kenney.nl/assets/watercraft-kit",
      "license": "CC0-1.0"
    },
    "hullForm": "flat-bottomed punt hull, caged air propeller aft",
    "propulsion": [
      "power"
    ],
    "shows": [
      "fan"
    ],
    "loaM": 5.5,
    "beamM": 2.4,
    "draftM": 0.2,
    "nominal": true,
    "fitLengthM": [
      3.9,
      6.9
    ],
    "proportions": {
      "lengthBeam": 1.608,
      "lengthHeight": 1.314
    },
    "frame": {
      "waterlineZ": 0,
      "hullX": [
        -1.435,
        1.435
      ]
    },
    "lights": {
      "masthead": [
        -0.582,
        1.878
      ],
      "sidelight": [
        0.816,
        0.516
      ],
      "stern": [
        -1,
        1.878
      ]
    }
  },
  {
    "file": "kenney-boat-fishing-small.glb",
    "name": "Small stern trawler",
    "kind": "kit",
    "fidelity": "stylised",
    "source": {
      "kit": "Kenney Watercraft Kit",
      "kitFile": "boat-fishing-small.glb",
      "url": "https://kenney.nl/assets/watercraft-kit",
      "license": "CC0-1.0"
    },
    "hullForm": "displacement fishing hull, wheelhouse forward, working deck aft",
    "propulsion": [
      "power"
    ],
    "shows": [
      "wheelhouse",
      "fishing-gear"
    ],
    "loaM": 12,
    "beamM": 4.5,
    "draftM": 2,
    "nominal": true,
    "fitLengthM": [
      8,
      18
    ],
    "aisType": 30,
    "proportions": {
      "lengthBeam": 2.168,
      "lengthHeight": 1.488
    },
    "frame": {
      "waterlineZ": 0,
      "hullX": [
        -1.935,
        1.935
      ]
    },
    "lights": {
      "masthead": [
        -0.14,
        1.657
      ],
      "sidelight": [
        0.865,
        0.637
      ],
      "stern": [
        -1,
        0.637
      ]
    }
  },
  {
    "file": "kenney-boat-house-a.glb",
    "name": "Motor yacht",
    "kind": "kit",
    "fidelity": "stylised",
    "source": {
      "kit": "Kenney Watercraft Kit",
      "kitFile": "boat-house-a.glb",
      "url": "https://kenney.nl/assets/watercraft-kit",
      "license": "CC0-1.0"
    },
    "hullForm": "semi-displacement motor-yacht hull, enclosed deckhouse",
    "propulsion": [
      "power"
    ],
    "shows": [
      "cabin"
    ],
    "loaM": 24,
    "beamM": 6,
    "draftM": 1.8,
    "nominal": true,
    "fitLengthM": [
      20,
      36
    ],
    "aisType": 37,
    "proportions": {
      "lengthBeam": 1.734,
      "lengthHeight": 2.138
    },
    "frame": {
      "waterlineZ": 0,
      "hullX": [
        -2.322,
        2.322
      ]
    },
    "lights": {
      "masthead": [
        0.09,
        1.154
      ],
      "sidelight": [
        0.958,
        0.531
      ],
      "stern": [
        -1,
        0.531
      ]
    }
  },
  {
    "file": "kenney-boat-house-b.glb",
    "name": "Motor yacht",
    "kind": "kit",
    "fidelity": "stylised",
    "source": {
      "kit": "Kenney Watercraft Kit",
      "kitFile": "boat-house-b.glb",
      "url": "https://kenney.nl/assets/watercraft-kit",
      "license": "CC0-1.0"
    },
    "hullForm": "semi-displacement motor-yacht hull, enclosed deckhouse",
    "propulsion": [
      "power"
    ],
    "shows": [
      "cabin"
    ],
    "loaM": 24,
    "beamM": 6,
    "draftM": 1.8,
    "nominal": true,
    "fitLengthM": [
      20,
      36
    ],
    "aisType": 37,
    "proportions": {
      "lengthBeam": 2.073,
      "lengthHeight": 2.526
    },
    "frame": {
      "waterlineZ": 0,
      "hullX": [
        -2.776,
        2.776
      ]
    },
    "lights": {
      "masthead": [
        0.445,
        0.977
      ],
      "sidelight": [
        0.898,
        0.369
      ],
      "stern": [
        -1,
        0.451
      ]
    }
  },
  {
    "file": "kenney-boat-house-c.glb",
    "name": "Motor yacht",
    "kind": "kit",
    "fidelity": "stylised",
    "source": {
      "kit": "Kenney Watercraft Kit",
      "kitFile": "boat-house-c.glb",
      "url": "https://kenney.nl/assets/watercraft-kit",
      "license": "CC0-1.0"
    },
    "hullForm": "semi-displacement motor-yacht hull, enclosed deckhouse",
    "propulsion": [
      "power"
    ],
    "shows": [
      "cabin"
    ],
    "loaM": 24,
    "beamM": 6,
    "draftM": 1.8,
    "nominal": true,
    "fitLengthM": [
      20,
      36
    ],
    "aisType": 37,
    "proportions": {
      "lengthBeam": 1.924,
      "lengthHeight": 1.716
    },
    "frame": {
      "waterlineZ": 0,
      "hullX": [
        -2.576,
        2.576
      ]
    },
    "lights": {
      "masthead": [
        -0.213,
        1.438
      ],
      "sidelight": [
        0.877,
        0.42
      ],
      "stern": [
        -1,
        0.486
      ]
    }
  },
  {
    "file": "kenney-boat-house-d.glb",
    "name": "Motor yacht",
    "kind": "kit",
    "fidelity": "stylised",
    "source": {
      "kit": "Kenney Watercraft Kit",
      "kitFile": "boat-house-d.glb",